,From,From (name),Subject,Email Text,spam,no_reply,company,reason,Email Length
149,invitations@linkedin.com,Vaishali Khare,Priyanjali please add me to your LinkedIn network,Hi Priyanjali Id like to join your LinkedIn network             Priyanjali Gupta                                                                                                                                                                                                                                                                                                                                                                                                                                     Hi Priyanjali Id like to join your LinkedIn network                            Vaishali Khare                                  MBA at Vellore institute of technology                                  New Delhi Delhi India                                 Accept                                  View profile  Link httpswwwlinkedincomcommmynetworkinviteacceptinvitationId6865636410553090048sharedKeyIOfslFnBmidTokenAQHrmYVbwwfGqQmidSig0A4SPy2wX3ia01trkemlemailm2minvitesingle01null1accept7Einvite7EgmailquickactiontrkEmailemlemailm2minvitesingle01null1accept7Einvite7Egmailquickactionnulld6e76j7Ekvz9qt8u7E99nullneptune2Fmynetwork2Einvite7Eacceptlipiurn3Ali3Apage3Aemailemailm2minvitesingle013BPKwHG7iQR5uxHR6zZg2BWkA3D3D Link httpswwwlinkedincom                                                                                                                                                                                                                                  Unsubscribe     Help                                                                                                                                                                                                                          You are receiving Invitation emails                                                                                                                                                                This email was intended for Priyanjali Gupta Student at Vellore Institute of Technology Core Committee member Robovitics  Learn why we included this                                                                                                                                                                                                                                                                                                                                                                     2021 LinkedIn Ireland Unlimited Company Wilton Plaza Wilton Place Dublin 2 LinkedIn is a registered business name of LinkedIn Ireland Unlimited Company LinkedIn and the LinkedIn logo are registered trademarks of LinkedIn,0,0,linkedin,invitations,2628
150,order-update@amazon.in,"""Amazon.in""",Delivered Your Amazon package has been delivered,Hi Priya  Your package has been delivered  Please rate your delivery experience  Return or replace items in Your Orders  Order  40663412573433908  This email was sent from an email address that cant receive emails Please dont reply to this email,0,0,amazon,order-update,245
151,jobalerts-noreply@linkedin.com,LinkedIn Job Alerts,30 new jobs for android developer,View jobs in India                                                                                                                                                                  Your job alert for android developer 30 new jobs in India match your preferences       Android Developer  JobCandi  Mumbai Maharashtra India            Actively recruiting        Middle Android Developer  EPAM Anywhere  Mumbai Maharashtra India            Actively recruiting        Android Developer  EPAM Anywhere  New Delhi Delhi India            Actively recruiting        Android Developer  EPAM Anywhere  Chennai Tamil Nadu India            Actively recruiting   Freelance Android Developer       Prana Healthcare Enablers Pvt  Ltd  Bengaluru Karnataka India        Android Developer  Consumer Engineering  Goldman Sachs  Bengaluru North Karnataka India            Actively recruiting See all jobs     See jobs where youre a top applicant       Try Premium for free      This email was intended for Priyanjali Gupta Student at Vellore     Institute of Technology Core Committee member Robovitics  Learn     why we included this      You are receiving Job Alert emails     Manage job alerts     Unsubscribe     Help       2021 LinkedIn Ireland Unlimited Company Wilton Plaza Wilton     Place Dublin 2 LinkedIn is a registered business name of     LinkedIn Ireland Unlimited Company LinkedIn and the LinkedIn     logo are registered trademarks of LinkedIn,0,0,linkedin,jobalerts-noreply,1439
152,jobalerts-noreply@linkedin.com,LinkedIn Job Alerts,1 new job for developer intern,View jobs in United States                                                                                                                                                                  Your job alert for developer intern 1 new job in United States matches your preferences       Backend Developer Intern  Pure Match  United States            Actively recruiting See all jobs     See jobs where youre a top applicant       Try Premium for free      This email was intended for Priyanjali Gupta Student at Vellore     Institute of Technology Core Committee member Robovitics  Learn     why we included this      You are receiving Job Alert emails     Manage job alerts     Unsubscribe     Help       2021 LinkedIn Ireland Unlimited Company Wilton Plaza Wilton     Place Dublin 2 LinkedIn is a registered business name of     LinkedIn Ireland Unlimited Company LinkedIn and the LinkedIn     logo are registered trademarks of LinkedIn,0,0,linkedin,jobalerts-noreply,933
153,jobalerts-noreply@linkedin.com,LinkedIn Job Alerts,30 new jobs for developer,View jobs in Chicago Illinois United States                                                                                                                                                                  Your job alert for developer 30 new jobs in Chicago Illinois United States match your preferences       Application Developer  4027811  Accenture  Chicago Illinois United States                        1 connection        BackEnd Developer  Critical Mass  Chicago Illinois United States            Actively recruiting        Fullstack Net core Developer  RSM US LLP  Chicago Illinois United States            Actively recruiting        Fullstack Front End Developer  Motion Recruitment  Chicago Illinois United States            Actively recruiting        Full Stack Developer  Square 6  United States            Actively recruiting        React JS Developer  Infosys  United States                        2 connections See all jobs     See jobs where youre a top applicant       Try Premium for free      This email was intended for Priyanjali Gupta Student at Vellore     Institute of Technology Core Committee member Robovitics  Learn     why we included this      You are receiving Job Alert emails     Manage job alerts     Unsubscribe     Help       2021 LinkedIn Ireland Unlimited Company Wilton Plaza Wilton     Place Dublin 2 LinkedIn is a registered business name of     LinkedIn Ireland Unlimited Company LinkedIn and the LinkedIn     logo are registered trademarks of LinkedIn,0,0,linkedin,jobalerts-noreply,1492
154,do-not-reply@webtoon.com,WEBTOON Update,Before We Knew It Episode 86 has been updated,Frooti check out the latest episode of your     subscribed series Before We Knew It Episode 86                        READ MORE Wherever you are enjoy stories for free on WEBTOON  You are receiving this email because you are registered with WEBTOON and have       agreed to receive email notifications To no longer receive email                     notifications unsubscribe from here                            WEBTOON Entertainment Inc,0,0,webtoon,do-not-reply,437
155,jobalerts-noreply@linkedin.com,LinkedIn Job Alerts,30 new jobs for site engineer,View jobs in Worldwide                                                                                                                                                                  Your job alert for site engineer 30 new jobs in Worldwide match your preferences       Site Reliability Engineer  Oracle  United States                        3 connections        Site Reliability Engineer  Eaton  Moon Pennsylvania United States            Actively recruiting        Site Reliability Engineer4 Openings  Grab  Bengaluru Karnataka India                      1 school alum        Site Reliability Engineer SRE Apple Cloud Services  Apple  Cupertino California United States                      1 school alum        Azure Site Reliability Engineer  UBS  Hong Kong Hong Kong SAR            Actively recruiting        Site Reliability Engineer  OpenZeppelin  United States            Actively recruiting See all jobs     See jobs where youre a top applicant       Try Premium for free      This email was intended for Priyanjali Gupta Student at Vellore     Institute of Technology Core Committee member Robovitics  Learn     why we included this      You are receiving Job Alert emails     Manage job alerts     Unsubscribe     Help       2021 LinkedIn Ireland Unlimited Company Wilton Plaza Wilton     Place Dublin 2 LinkedIn is a registered business name of     LinkedIn Ireland Unlimited Company LinkedIn and the LinkedIn     logo are registered trademarks of LinkedIn,0,0,linkedin,jobalerts-noreply,1469
156,expertspeak@techgig.com,TechGig Webinar,LIVE WEBINAR Implementing ML systems in B2B space,LIVE WEBINAR November 15 2021 0500 PM  Hosted by Sujith Kumar  Engineering Director Media and CE product engineering Dunnhumby  Implementing ML systems in B2B space  SAVE MY SPOT               Hi Priyanjali               We would like to invite you to a FREE Webinar session              on the topic Implementing ML systems in B2B space               About Webinar Machine Learning is seeing rapid              adoption and application in Retail sector There are              unique challenges in building and operating ML systems              in this smore               Yes Save My Spot Now               During this FREE Webinar our experts will discuss                  Key architectural components of ML Systems and                  system goals                 Importance of continuous monitoring and key test                  frameworks                 Best Practices for ML Deployments                                               Speaker Details                                               Sujith Kumar                                              Engineering Director                                              Media and CE                                              product                                              engineering                                              Dunnhumby                                               Book Your Seat               Warm Regards              Team TechGig  2021  TechGig  Terms of Use  Contact Us Times Center FC  6 Sector 16 A Film City Noida  201301 Uttar Pradesh India  Follow Us on             Download App            Note For your privacy and protection please do not forward this mail to anyone as it allows you to get automatically logged into your account You have received this email because your are registered member on TechGigcom If you do not want to receive this mailer please unsubscribe here To make sure this email is not sent to your junkspam folder select the email and add the sender to your Address Book,0,0,techgig,expertspeak,1987
157,info@twitter.com,Twitter,Kunal Kamra Tweeted Now who did this,Your Highlights                 Kunal Kamra                       kunalkamra88  Now who did this               730                 49K                25K                  Aarti                       aartic02  So madam is adressing her Freedom Fighter Grandfather as a Beggar too  ShameOnKangana             23                  140                 310               Swara Bhasker                    ReallySwara  Disingenuous and Two days late  Your anchor shouldve challenged challenged this idiotic statement right  then instead of simpering along with an applauding crowd Shameful conduct  TimesNow  twittercomTimesNowstatu            240                 490                 33K            Manish Sisodia                 msisodia  All schools colleges and educational institutes in Delhi to remain shut  next week as pollution levels hit emergency level            250                 600                 34K      Priyanka Chaturvedi           priyankac19  Point Why should IPL not be taxed It is not sports promotion purely  profit maximisation twittercomhvgoenkastatu            86                  210                 16K                  Nidhi Razdan                       Nidhi  Hows that smog tower doing            250                 190                 26K                             See more on Twitter             Help    Privacy    Reset password    Download app             We sent this email to Priyanj88966134 Unsubscribe                        Twitter International Company                     One Cumberland Place Fenian Street                         Dublin 2 D02 AX07  IRELAND,0,0,twitter,info,1597
158,invitations@linkedin.com,LinkedIn,Parikshit wants to join your network,More opportunities to grow your network    Priyanjali Gupta                                           Heres a summary of your latest invitations to connect           Parikshit Choube                     Accept               Mechanical Engineer  Ex VITian                You have 15 connections in common               Accept          View profile See all invitations                           Unsubscribe     Help                   You are receiving Invitation emails     This email was intended for Priyanjali Gupta Student at Vellore Institute of Technology Core Committee member Robovitics  Learn why we                              included this                                      2021 LinkedIn Ireland Unlimited Company Wilton Plaza Wilton Place   Dublin 2 LinkedIn is a registered business name of LinkedIn Ireland     Unlimited Company LinkedIn and the LinkedIn logo are registered                          trademarks of LinkedIn,0,0,linkedin,invitations,938
159,technews@techgig.com,TechGig Latest News,IIMs to enroll IT professionals tech graduates CAT not needed  PayPal is hiring software engineers for Hyderabad Chennai apply now,Daily Newsletter   Sunday 14th November 2021   IIMs to enroll IT professionals tech graduates CAT not needed   PayPal is hiring software engineers for Hyderabad Chennai apply now   Kickstart your career in Artificial Intelligence with this specialisation  course   HCL announces new apprenticeship program for hiring freshers   4 Highestpaying jobs for Rust programmers   IIT Bombay launches free online course in Quantum Physics apply now   Salary check How much does a software engineer at Cognizant earns   DRDO is hiring BEBTech freshers for 116 job vacancies apply now   Krafton announces strict measures to address hackers on BGMI   EY looking for experienced backend developers Apply now   5 Free online programming courses by Harvard University   Looking for a job at HCL Follow these tips to get hired faster   Top 5 tech jobs with fastest rising salaries   Can your AI AR Full Stack and Cloud skills make healthcare accessible  Elsevier is looking for you   Microsoft India is looking for BTech interns Apply now   Your job hunt ends here Cognizant Capgemini LT and others are hiring   IIT Madras and Kharagpur offer free online courses in AI and IoT   Countless jobs for freshers TCS HCL Wipro hiring amid high attrition   Learn these 7 programming languages to boost your salary   Facebook is offering certificate courses to build career in Metaverse   Mindblowing futuristic technologies that may come true                        See more news                        2021 TechGig  Terms of Use  Contact Us   TechGigcom Times Center FC  6 Sector 16 A Film City Noida  201301   Uttar Pradesh India    Spread the word about TechGig                              App Available on     Note For your privacy and protection please do not forward this mail to      anyone as it allows you to get automatically logged into your account        You have received this email because your are registered member on   TechGigcom If you do not want to receive this mailer unsubscribe To make   sure this email is not sent to your junkbulk folder select Addsave to   Address Book in your email browser and follow the appropriate instructions,0,0,techgig,technews,2136
160,promotion@techgig.com,TechGig,OSDC 2021,Hi Priyanjali   Developers are changing the way the world builds software with the   OutSystems platform Accelerate your career by joining us at the OutSystems   Developer Conference this year on November 1718 Learn about the latest   cuttingedge tech for modern application development and how it can help you   build more apps faster better and for the future    OSDC is a conference by developers for developers with a lot of indepth   and technical sessions around modern application development Plus this   will be the biggest OutSystems developer conference yet with speakers   trainers and attendees joining virtually from all around the globe    Some of the event highlights include      Getting handson with new developer tech      Actionable and technical sessions that focus on solving realworld       problems      How to become an OutSystems expert and add new skills to your arsenal   If youre interested in attending click below for registering Hope to   see you there    Click here to Register   Best   OutSystems India  2021  TechGig  Terms of Use  Contact Us Times Center FC  6 Sector 16 A Film City Noida  201301 Uttar Pradesh India  Follow Us on             Download App            Note For your privacy and protection please do not forward this mail to anyone         as it allows you to get automatically logged into your account If you do not want to receive this mailer unsubscribe To make sure this email                     is not sent to your junkbulk folder      select Addsave to Address Book in your email browser and follow the                            appropriate instructions,0,0,techgig,promotion,1610
161,shipment-tracking@amazon.in,"""Amazon.in""",Your Amazonin order 40663412573433908 of 1 item has been dispatched,Your Orders     Your Account                      Amazonin                   Shipping Confirmation                   Order 40663412573433908 Hello Priya  We thought youd like to know that weve dispatched your items Your order is on the way If you need to return an item from this shipment or manage other orders please visit Your Orders on Amazonin Arriving                           Your package was sent to  Sunday November 14                 Priyanjali                                     NEW DELHI DELHI  Your items is are being sent by Amazon Transportation Services Your tracking number is 156417257442 Please note that a signature may be required for the delivery of the package Order summary Item Subtotal                                      Rs25100 Shipping  Handling                                Rs000 POD Convenience Fee                                Rs000 Shipment Total                                     Rs25100 Payment Pending                                    Rs25100 Track your order with the Amazon App We hope to see you again soon Amazonin Buy it again                                      tupperware Plastic Container        Wildcraft 295 Ltrs Black Casual 84000                             118900 This email was sent from a notificationonly address that cannot accept incoming email Please do not reply to this message,0,0,amazon,shipment-tracking,1346
162,info@twitter.com,Twitter,Priyanjali dont be selfish,Retweet                        Too good to keep to yourself  When you come across a Tweet you want to share tap the Retweet icon and  the people who follow you will see it Check out our collection of top      videos on Twitter and Retweet your favorite to your followers                           See more on Twitter            Help    Privacy    Reset Password    Download App               We sent this to Priyanj88966134 Unsubscribe    Twitter Inc 1355 Market Street Suite 900 San Francisco CA 94103,1,0,twitter,info,502
163,auto-confirm@amazon.in,"""Amazon.in""",Your Amazonin order 40663412573433908 of 1 item,Your Orders     Your Account    Amazonin   Order Confirmation         Order  40663412573433908   Hello Priya  Thank you for your order Well send a confirmation when your order ships Your estimated delivery date is indicated below If you would like to view the status of your order or make any changes to it please visit Your Orders on Amazonin Arriving Sunday November 14                                                     Your order will be sent to Your shipping speed                                Priyanjali SameDay Delivery at Rs 150 per item FREE with    NEW DELHI DELHI Prime                                               India  View or manage order   Order summary Order 40663412573433908 Placed on Sunday November 14 2021 Item Subtotal                                     Rs25100 Shipping  Handling                               Rs000 Order Total                                       Rs25100 Payment Pending                                   Rs25100 If you use a mobile device you can receive notifications about the delivery of your package and track it from our free Amazon app To ensure your safety the Delivery Agent will drop the package at your doorstep ring the doorbell and then move back 2 meters while waiting for you to collect your package If you are in a containment zone the agent will call you and request you to collect your package from the nearest accessible point while following the same NoContact delivery process We hope to see you again soon Amazonin Top picks for you       Organic India Tulsi Ginger               Organic India Tulsi Mulethi 25  Turmeric                        Tea Bags       16800                                  16800 This email was sent from a notificationonly address that cannot accept incoming email Please do not reply to this message,0,0,amazon,auto-confirm,1795
164,account-update@amazon.in,"""amazon.in""",amazonin action needed Account data access attempt,Account data access attempt Priya Someone is attempting to access your account data When    Nov 14 2021 0100 AM India Standard Time Device  Amazon Shopping App for Android Near    India Approve or Deny Is it safe to follow this link  The link provided in this email starts with httpswwwamazonin If you prefer copy the following link and paste it into a browser to view httpswwwamazoninacr7TrCVdTvOAp0GhihoyYk7kAjd,0,0,amazon,account-update,413
165,do-not-reply@webtoon.com,WEBTOON Update,Midnight Poppy Land Episode 82 has been updated,Frooti check out the latest episode of your    subscribed series Midnight Poppy Land Episode 82                        READ MORE Wherever you are enjoy stories for free on WEBTOON  You are receiving this email because you are registered with WEBTOON and have       agreed to receive email notifications To no longer receive email                     notifications unsubscribe from here                            WEBTOON Entertainment Inc,0,0,webtoon,do-not-reply,438
