,From,From (name),Subject,Email Text,spam,no_reply,company,reason,Email Length
0,contestinvite@codechef.com,Meg from CodeChef,Coders youre invited to CODERS Div 2  3 Rated  Nov 24,Hola CodeCheffers  Tomorrow were serving you a different treat in the form of the externalrated competition CODERS The contest is going to be hosted by the CodeChef Chapter of the  Netaji Subhas University of Technology and will be rated for both Division Two and Three players The competition is going to be based on algorithms data structures and you guessed it problemsolving Sounds like a fun 3 hours huh  Contest Details  Date Wednesday 24th Nov 2021  Time 0800 PM                                    COMPETE HERE  Thats Not All  The DramaFilled November CookOff  If you happened to miss the exciting ordeal that the November CookOff was dont fret weve got you covered with our match report                                 READ MATCH REPORT  Job Listing on CodeChef  Five new companies have listed their open technical roles on CodeChef Explore these opportunities and apply if you are interested We will keep listing more and more job opportunities for our hardworking problemsolvers like you                                   CHECK THE JOBS  Zonal Informatics Olympiad Registration Closes tomorrow  School Olympiad  One of the two initial steps to the International Olympiad in Informatics IOI the Zonal Informatics Olympiads registration is closing on November 24th but the Zonal Computing Olympiad ZCO registrations are open till December 8th 2021                                   REGISTER HERE  Thats all for now  Meg Team CodeChef  If you do not wish to receive emails from us you can unsubscribe,0,0,codechef,contestinvite,1507
1,messages-noreply@linkedin.com,LinkedIn,341 people are noticing you,See whos looking at your profile                                                                                                                                                                                       Your profile is looking great            Your work and accomplishments are being recognized                                     341                               profile views             See whos looking      This email was intended for Priyanjali Gupta Student at Vellore     Institute of Technology Core Committee member Robovitics  Learn     why we included this      You are receiving Professional Identity Digest emails     Unsubscribe     Help       2021 LinkedIn Ireland Unlimited Company Wilton Plaza Wilton     Place Dublin 2 LinkedIn is a registered business name of     LinkedIn Ireland Unlimited Company LinkedIn and the LinkedIn     logo are registered trademarks of LinkedIn,1,0,linkedin,messages-noreply,904
2,messaging-digest-noreply@linkedin.com,ARUMULLA YASWANTH REDDY via LinkedIn,ARUMULLA YASWANTH just messaged you,3 new messages await your response  ARUMULLA YASWANTH REDDY Student at VITVellore Institute of Technology              View messages  View messages      This email was intended for Priyanjali Gupta Student at Vellore     Institute of Technology Core Committee member Robovitics  Learn     why we included this      You are receiving Messages digest emails     Unsubscribe     Help       2021 LinkedIn Ireland Unlimited Company Wilton Plaza Wilton     Place Dublin 2 LinkedIn is a registered business name of     LinkedIn Ireland Unlimited Company LinkedIn and the LinkedIn     logo are registered trademarks of LinkedIn,0,0,linkedin,messaging-digest-noreply,619
3,no-reply@spotify.com,Spotify,Breathe in breathe out,Spend quality time with yourself   Spend quality  time with yourself   Explore genres like   Meditation                       Yoga    FIND YOUR ZEN       Get Spotify for  iPhone iPad Android Other      This message was sent to utaku0611gmailcom If you dont want to receive  these emails from Spotify in the future you can edit your profile or  unsubscribe  Terms of Use Privacy Policy Contact Us  Spotify AB Regeringsgatan 19 111 53 Stockholm Sweden,1,1,spotify,no-reply,449
4,jobalerts-noreply@linkedin.com,LinkedIn Job Alerts,30 new jobs for android developer,View jobs in India                                                                                                                                                                  Your job alert for android developer 30 new jobs in India match your preferences       Android Developer  Future Shine Consultancy  Work from Anywhere  Ahmedabad Gujarat       India Hybrid        Android Developer  Advantal Technologies Private Limited  Indore Madhya Pradesh       India Onsite            Actively recruiting        Android Developer  ICwares Systems  Softwares India Pvt Ltd  Trivandrum Kerala       India Onsite   Android Developer       The Dezine  Ahmedabad Gujarat India Onsite        Android Developer  TOROi Technologies Private Limited  Gurugram Haryana India       Onsite        Android Developer  Clavax  Gurugram Haryana India Onsite            Actively recruiting See all jobs     See jobs where youre a top applicant       Try Premium for free      This email was intended for Priyanjali Gupta Student at Vellore     Institute of Technology Core Committee member Robovitics  Learn     why we included this      You are receiving Job Alert emails     Manage job alerts     Unsubscribe     Help       2021 LinkedIn Ireland Unlimited Company Wilton Plaza Wilton     Place Dublin 2 LinkedIn is a registered business name of     LinkedIn Ireland Unlimited Company LinkedIn and the LinkedIn     logo are registered trademarks of LinkedIn,0,0,linkedin,jobalerts-noreply,1441
5,jobalerts-noreply@linkedin.com,LinkedIn Job Alerts,3 new jobs for developer intern,View jobs in United States                                                                                                                                                                  Your job alert for developer intern 3 new jobs in United States match your preferences       Application Developer Intern  ManTech  Clarksburg West Virginia United States Onsite            Actively recruiting        DI Microsoft Access Developer Summer Intern  Frontier Technology  Chesapeake Virginia United States            Actively recruiting        Firmware  BIOS Developer Intern  Intel Corporation  Phoenix Arizona United States                        1 connection See all jobs     See jobs where youre a top applicant       Try Premium for free      This email was intended for Priyanjali Gupta Student at Vellore     Institute of Technology Core Committee member Robovitics  Learn     why we included this      You are receiving Job Alert emails     Manage job alerts     Unsubscribe     Help       2021 LinkedIn Ireland Unlimited Company Wilton Plaza Wilton     Place Dublin 2 LinkedIn is a registered business name of     LinkedIn Ireland Unlimited Company LinkedIn and the LinkedIn     logo are registered trademarks of LinkedIn,0,0,linkedin,jobalerts-noreply,1228
6,linkedin@e.linkedin.com,LinkedIn Learning,Priyanjali grow your skills with unlimited access to expertled courses for 30 days,Grow your skills on LinkedIn Learning Get unlimited access to expertled courses                         Explore courses                               Advance your career Discover personalized uptodate content taught by industry experts with quizzes and project files to assess your progress                               Stand out to recruiters Show off the new skills youve learned on your LinkedIn profile by earning a certificate for each course youve watched                               Learn on the go Watch anywhere anytime with audioonly or by downloading courses for offline viewing                               Access LinkedIns Premium features Features include InMail credits job and salary insights Whos viewed your profile and many more                         Explore courses This email was intended for Priyanjali Gupta Student at Vellore Institute of Technology Core Committee member Robovitics Learn why we included this  This is an occasional email to help you get the most out of LinkedIn  Unsubscribe    Help   2021 LinkedIn Ireland Unlimited Company All rights reserved LinkedIn Ireland Unlimited Company Gardner House Wilton Plaza Wilton Place Dublin 2 Ireland LinkedIn and the LinkedIn logo are registered trademarks of LinkedIn,1,0,e,linkedin,1253
7,technews@techgig.com,TechGig Latest News,Offices reopen but 75 of TCS techies to work from home till 2022  Deloitte kickstarts its India Internship 2022 Apply now,Daily Newsletter   Tuesday 23rd November 2021   Offices reopen but 75 of TCS techies to work from home till 2022   Deloitte kickstarts its India Internship 2022 Apply now   Advance your career in Data Science  Business Analytics with this exclusive  course   Talent war Mindtree LT Infotech midsized IT firms hiring freshers   Ransomware attacks targeting crypto investors via fake apps Report   10 highest paying jobs for techies with computer science degree   Kickstart your career in Data Engineering with this PG program by IIITH   Enroll in these IT courses by IITs to get IIT Alumni status   Top 5 Indian IT companies to hire 96000 techies for FY22 apply now   Meta delays endtoend encryption for Messenger Instagram till 2023   HP is looking for BTech interns in Bangalore apply now   El Salvador to become worlds first Bitcoin city backed by Bitcoin bonds   Joker Malware has returned Remove these 15 apps from your Android devices   Enrol for these free AIData Science courses from Harvard MIT Google  Microsoft   IT giants in India use these programming languages see list   How to ace your tech job interview at Capgemini   What will be the fastest growing IT technologies of 2022   Tim Cook asks Apple employees to return to office from Feb 2022   IIT Roorkee launches online certificate course in software development   Wipro is hiring freshers graduates for Analyst posts Apply now                        See more news                        2021 TechGig  Terms of Use  Contact Us   TechGigcom Times Center FC  6 Sector 16 A Film City Noida  201301   Uttar Pradesh India    Spread the word about TechGig                              App Available on     Note For your privacy and protection please do not forward this mail to      anyone as it allows you to get automatically logged into your account        You have received this email because your are registered member on   TechGigcom If you do not want to receive this mailer unsubscribe To make   sure this email is not sent to your junkbulk folder select Addsave to   Address Book in your email browser and follow the appropriate instructions,1,0,techgig,technews,2112
8,updates@myntra.com,Myntra,Click To Reset Your Wardrobe,On A Budget   If you would prefer not receiving our emails please click here to unsubscribe  If you would like to experience the best of online shopping for men women and kids in India you are at theright place Myntra is the ultimate destination for fashion and lifestyle being host to a wide array of merchandise including clothingfootwearaccessories jewellery personal care products and more It is time to redefine your style statement with our treasuretrove of trendy items Our online store brings you the latest in designer products straight out of fashion houses You can shop online at Myntra from the comfort of your home and get your favourites delivered right to your doorsteps,1,0,myntra,updates,685
9,support@cloudhq.net,cloudHQ,One more Gmail tool to try Save Emails to PDF,Here is one more Chrome extension you might be interested to try  and please email us back if you have any questions or issues We are here to help                                 Save Emails to PDF  Save Emails to PDF lets you easily save Gmail emails as a PDF document on your computers hard drive Our service works in just 1 click includes any attachments and youre done  You can also save multiple emails to   as one PDF document with all emails   zip file with all emails in PDF   as one HTML document with all emails   as a text file   Options   include  exclude attachments   add page numbers   page size   encryption with password protection   Saving your email as PDF is great to  Send all of your ereceipts in 1 pdf to your accountant  Organize all your emails for litigation to send to your lawyer  Create a PDF with all email messages related to your transaction or project  Create a hard copy backup of your emails for your own records                             Install Save Emails to PDF                  Want to see a new feature Anything we can fix  We love our community and always want to make sure that youre well served If you need something that cloudHQ doesnt offer or there are things we should fix please let us know Our email is supportcloudhqnet  Ultimately we cant make things better without your feedback  Cheers  The cloudHQ team                 Copyright  2021 cloudHQ LLC All rights reserved                             Our mailing address is                                   cloudHQ LLC                                  2127 30th Ave                             San Francisco CA 94116    This email was sent to  utaku0611gmailcom  because youre using cloudHQ                                   unsubscribe,0,0,cloudhq,support,1738
10,jobalerts-noreply@linkedin.com,LinkedIn Job Alerts,30 new jobs for developer,View jobs in Chicago Illinois United States                                                                                                                                                                  Your job alert for developer 30 new jobs in Chicago Illinois United States match your preferences       Frontend Developer  Parker and Lynch  United States Remote            Actively recruiting   FullStack Developer Remote       Halo  Chicago Illinois United States Remote        PHP Developer  Dealer Inspire  United States Remote            Actively recruiting        Software Developer  Mobinity Global  Chicago Illinois United States Onsite            Actively recruiting        Java Developer       Arthur Grand Technologies  Chicago Illinois United States  Hybrid            Actively recruiting                      Easy Apply        Junior Backend Developer  Applied Insight LLC  United States Remote            Actively recruiting See all jobs     See jobs where youre a top applicant       Try Premium for free      This email was intended for Priyanjali Gupta Student at Vellore     Institute of Technology Core Committee member Robovitics  Learn     why we included this      You are receiving Job Alert emails     Manage job alerts     Unsubscribe     Help       2021 LinkedIn Ireland Unlimited Company Wilton Plaza Wilton     Place Dublin 2 LinkedIn is a registered business name of     LinkedIn Ireland Unlimited Company LinkedIn and the LinkedIn     logo are registered trademarks of LinkedIn,0,0,linkedin,jobalerts-noreply,1512
11,expertspeak@techgig.com,TechGig Webinar,WEBINAR Building The Next Generation Of Mobile Apps To Transform Wealth Management,LIVE WEBINAR November 30 2021 0300 PM  Hosted by Bhaavika Panjwani  Vice President Goldman Sachs  Building The Next Generation Of Mobile Apps To Transform Wealth Management  SAVE MY SPOT               Hi Priyanjali               We would like to invite you to a FREE Webinar session              on the topic Building The Next Generation Of Mobile              Apps To Transform Wealth Management               About Webinar This talk will focus on how the              engineering team at Goldman Sachs is working towards              transforming the way our clients manage their wealth              By providinmore               Yes Save My Spot Now               During this FREE Webinar our experts will discuss                  Insights into security and authentication related                  mechanisms                 How the mobile app domain has evolved over the                  years                 Constructive customer feedback and the power of                  analytics to drive future projects                 Key learning from our previous attempts of                  building a cross platform app                                               Speaker Details                                               Bhaavika Panjwani                                              Vice President                                              Goldman Sachs                                               Book Your Seat               Warm Regards              Team TechGig  2021  TechGig  Terms of Use  Contact Us Times Center FC  6 Sector 16 A Film City Noida  201301 Uttar Pradesh India  Follow Us on             Download App            Note For your privacy and protection please do not forward this mail to anyone as it allows you to get automatically logged into your account You have received this email because your are registered member on TechGigcom If you do not want to receive this mailer please unsubscribe here To make sure this email is not sent to your junkspam folder select the email and add the sender to your Address Book,0,0,techgig,expertspeak,2047
12,jobalerts-noreply@linkedin.com,LinkedIn Job Alerts,30 new jobs for site engineer,View jobs in Worldwide                                                                                                                                                                  Your job alert for site engineer 30 new jobs in Worldwide match your preferences       DevOps Engineer Site Reliability Engineer  Amadeus  Dallas Texas United States            Actively recruiting        Site Operations Engineer  LinkedIn  Sunnyvale California United States Hybrid                      1 school alum        Site Project Engineer  Johnson Matthey  Swindon England United Kingdom Onsite            Actively recruiting        Site Reliability Engineer  FlightAware  United States Remote            Actively recruiting        SRESite Reliability EngineerInfra Engineer  Levy Professionals  London England United Kingdom            Actively recruiting        Site Engineer       Beauty Elements Ventures Manufacturing Inc Manufacturer of  Kojiesan Products  Makati National Capital Region Philippines       Onsite            Actively recruiting See all jobs     See jobs where youre a top applicant       Try Premium for free      This email was intended for Priyanjali Gupta Student at Vellore     Institute of Technology Core Committee member Robovitics  Learn     why we included this      You are receiving Job Alert emails     Manage job alerts     Unsubscribe     Help       2021 LinkedIn Ireland Unlimited Company Wilton Plaza Wilton     Place Dublin 2 LinkedIn is a registered business name of     LinkedIn Ireland Unlimited Company LinkedIn and the LinkedIn     logo are registered trademarks of LinkedIn,0,0,linkedin,jobalerts-noreply,1609
13,jobs-listings@linkedin.com,LinkedIn,GalaxyCard is looking for Software Developer Intern,Your job recommendations from LinkedIn                                                                                                                                                                  Top job picks for you       Software Developer Intern  GalaxyCard  Gurgaon Haryana India          Skills match Java Software Development and Python               Programming Language        Software Engineering Test Intern  NEW  ChargePoint  Gurgaon Haryana India            Actively recruiting        Software Engineering Fullstack Intern 6 months  Shipsy  Gurugram Haryana India            Actively recruiting                      Easy Apply        Internship for Software Programmers  NM Group  India            Actively recruiting                      Easy Apply        Intern  UIUX  FIS  Gurugram Haryana India                      2 school alumni        Full stack internship Remote  FULL Creative  Chennai Tamil Nadu India            Actively recruiting See all jobs     See jobs where youre a top applicant       Try Premium for free      This email was intended for Priyanjali Gupta Student at Vellore     Institute of Technology Core Committee member Robovitics  Learn     why we included this      You are receiving Jobs You Might Be Interested In emails     Manage recommendations     Unsubscribe     Help       2021 LinkedIn Ireland Unlimited Company Wilton Plaza Wilton     Place Dublin 2 LinkedIn is a registered business name of     LinkedIn Ireland Unlimited Company LinkedIn and the LinkedIn     logo are registered trademarks of LinkedIn,0,0,linkedin,jobs-listings,1556
14,do-not-reply@webtoon.com,WEBTOON Update,The Wrath  the Dawn S2 Ep 98 has been updated,Frooti check out the latest episode of your   subscribed series The Wrath  the Dawn S2 Ep 98                        READ MORE Wherever you are enjoy stories for free on WEBTOON  You are receiving this email because you are registered with WEBTOON and have       agreed to receive email notifications To no longer receive email                     notifications unsubscribe from here                            WEBTOON Entertainment Inc,0,0,webtoon,do-not-reply,435
15,english-personalized-digest@quora.com,Quora Daily Digest,Recruiters have you ever had to deal with a candidate that turned out to be complete,Frootis Digest   Top Stories For You   Recruiters have you ever had to deal with a candidate that turned out to be completely unqualified What happened Josh Beam Software engineer in Silicon Valley  Updated June 2 So there I was 11am just got my coffee I open my laptop and give the candidate a ring  I was scheduled that morning to conduct a phone screen with what looked like a very  Read More              11M                    44K                    99   How did you get your Amazon internship Rajat Gupta former Data Scientist II Intern at Amazon India 2021  Answered January 9  I joined Amazon as a Data Scientist intern on 4th January I am in the final semester of my Data Science course at IIM Calcutta which this internship is a part of I alon  Read More              1605K                        1K                13    How was your IIM Ahmedabad interview Ashutosh Patil MBA from Indian Institute of Management Ahmedabad  Updated May 26 Date 8th March 2021  Venue Lifestyle Building Begumpet Hyderabad  Profile  Xth  10 CGPA  Read More              121K                      169                  8   What do job recruiters just get that job seekers just dont David Seidman Former interviewer  hiring manager for Microsoft and Google  Updated February 28 We see tons of resumes that say nothing more than My name is John and I have had some jobs These resumes list a series of companies of no particular distinction a few   Read More             388K                   34K                   122   What is the CTC breakup of 3902 lpa offered by Microsoft How much is the actual base salary it includes Shaunak Bhattacharjeee Salesforce DevOps Engineer at Copado 2020present  Answered October 19  I have a friend whose brother got a PPO Offer from Microsoft in 2019 and had bagged a package of 39 LPA I had a chance to look into the CTC breakdown and below is the same  Read More             5792K                     21K                  44                       Read More in Your Feed                Never miss a story Designed for readers on the go         This email was sent by Quora 605 Castro Street Mountain View CA 94041      If you dont want to receive this type of email in the future please                                   unsubscribe                              httpswwwquoracom,1,0,quora,english-personalized-digest,2303
16,no-reply@mail.instagram.com,Instagram,priyanjali01 see Kylie Hannah  and more in your feed,Follow Kylie Hannah  and others you know to see their photos and videos  Open Instagram  Kylie  Suggested for you  Follow  Hannah   Suggested for you  Follow  Chaitanya Pandey  Suggested for you  Follow  Ryan Jenny  Suggested for you  Follow  Yishai Silver  Suggested for you  Follow  Matthew McCallum  Suggested for you  Follow  1  You have 1 notifications you may not have seen       Instagram Meta Platforms Inc 1601 Willow Road Menlo Park CA     94025 US     This message was sent to utaku0611gmailcom and intended for     priyanjali01 Instagram sends updates such as this to help you keep     up with the latest on Instagram You can unsubscribe from these     updates or remove your email address if this isnt your Instagram     account Unsubscribe or remove your email address from this account,1,1,mail,no-reply,800
