,From,From (name),Subject,Email Text,spam,no_reply,company,reason,Email Length
224,jobs-listings@linkedin.com,LinkedIn,EY is looking for Intern,Your job recommendations from LinkedIn                                                                                                                                                                  Top job picks for you       Intern  EY  Gurugram Haryana India                        1 connection        Software Developer Intern  GalaxyCard  Gurgaon Haryana India          Skills match Java Software Development and Python               Programming Language        Software Engineering Fullstack Intern 6 months  Shipsy  Gurugram Haryana India            Actively recruiting                      Easy Apply        Software Engineer Intern Frontend  5 Months Paid  WeatherBug  Gurgaon Haryana India            Actively recruiting        Internship for Software Programmers  NM Group  India            Actively recruiting                      Easy Apply        Software Engineer Intern Frontend  5 Months Paid  GroundTruth  Gurugram Haryana India            Actively recruiting See all jobs     See jobs where youre a top applicant       Try Premium for free      This email was intended for Priyanjali Gupta Student at Vellore     Institute of Technology Core Committee member Robovitics  Learn     why we included this      You are receiving Jobs You Might Be Interested In emails     Manage recommendations     Unsubscribe     Help       2021 LinkedIn Ireland Unlimited Company Wilton Plaza Wilton     Place Dublin 2 LinkedIn is a registered business name of     LinkedIn Ireland Unlimited Company LinkedIn and the LinkedIn     logo are registered trademarks of LinkedIn,0,0,linkedin,jobs-listings,1574
225,expertspeak@techgig.com,TechGig Webinar,WEBINAR Women in Tech Preparing for the future of work by reskilling and upskilling,LIVE WEBINAR November 12 2021 0300 PM  Hosted by Rashmi Chandrashekar  Director DXC Security GIDC DXC Technology  Women in Tech Preparing for the future of work by reskilling and upskilling  SAVE MY SPOT               Hi Priyanjali               We would like to invite you to a FREE Webinar session              on the topic Women in Tech Preparing for the future              of work by reskilling and upskilling               About Webinar The tech space is constantly evolving              and our skills need to keep pace with the same              Constant reskilling and upskilling is the only way              out Targetemore               Yes Save My Spot Now               During this FREE Webinar our experts will discuss                  Current landscape of women in tech                 Challenges and opportunities                 Targeted reskilling and upskilling for women to                  move into higherpaying job positions                 The need for women to break the glass ceiling is                  more than ever                                               Speaker Details                                               Rashmi Chandrashekar                                              Director DXC                                              Security GIDC DXC                                              Technology                                               Book Your Seat               Warm Regards              Team TechGig  2021  TechGig  Terms of Use  Contact Us Times Center FC  6 Sector 16 A Film City Noida  201301 Uttar Pradesh India  Follow Us on             Download App            Note For your privacy and protection please do not forward this mail to anyone as it allows you to get automatically logged into your account You have received this email because your are registered member on TechGigcom If you do not want to receive this mailer please unsubscribe here To make sure this email is not sent to your junkspam folder select the email and add the sender to your Address Book,0,0,techgig,expertspeak,2033
226,technews@techgig.com,TechGig Latest News,This is the highest paying programming language and its not Python  Your job hunt ends here Cognizant Capgemini LT and others are hiring,Daily Newsletter   Thursday 11th November 2021   This is the highest paying programming language and its not Python   Your job hunt ends here Cognizant Capgemini LT and others are hiring   Kickstart your career in Artificial Intelligence with this specialisation  course   Countless jobs for freshers TCS HCL Wipro hiring amid high attrition   Move over Elon Musk Bill Gates could be the richest person of 2021   Cognizant is hiring 1 lakh techies heres everything you must know   5 Biggest data science recruiters in India how to get hired   Advance your career in Data Science  Business Analytics with this course   5 tips for freshers by Google recruiters to make an impressive resume   HCL is hiring techies for its new AWS Business Unit apply now   Can your AI AR Full Stack and Cloud skills make healthcare accessible  Elsevier is looking for you   Switching career to IT Heres your howtoguide   Capgemini hiring BTech freshers for IT roles Apply now   Are you an experienced tech professional Join this Data Science course by MIT  IDSS   5 Mustsubscribe YouTube Channels for developers   See when OnePlus Samsung Xiaomi Oppo phones will get Android 12   Indian gamers can now compete in Asian Games 2022 see how   Ace your upcoming job interview with these tips   Explained What is Metaverse and how does it work   LT is mass hiring women techies apply in 3 steps   Top 3 highest paying Data Science job roles in IT Industry                        See more news                        2021 TechGig  Terms of Use  Contact Us   TechGigcom Times Center FC  6 Sector 16 A Film City Noida  201301   Uttar Pradesh India    Spread the word about TechGig                              App Available on     Note For your privacy and protection please do not forward this mail to      anyone as it allows you to get automatically logged into your account        You have received this email because your are registered member on   TechGigcom If you do not want to receive this mailer unsubscribe To make   sure this email is not sent to your junkbulk folder select Addsave to   Address Book in your email browser and follow the appropriate instructions,0,0,techgig,technews,2148
227,no-reply@sgp.flipkart.com,Flipkart,In taking a break we believe,Time to recharge yourself           We hope you enjoy emails from Flipkart If you wish to unsubscribe                                  please click here,1,1,sgp,no-reply,152
228,curiosity-noreply@quora.com,Quora,More related to How can you add a margin on both sides to a web template that use all 12 columns in B,Stories from your activity Do web designers use bootstrap  Julie Frey I have surfed online since its founding in 1994       Written Nov 14 2020 Some web developers use Bootstrap If you visit you can see a community of Bootstrap fans  But not all web developers use or need it  It is not required or mandated by anyone  Read More   How do I add spacing between columns in Bootstrap  Brokenglass Designs We are Chennai based Web Development company       Written Jul 29 2020 Simply add a div within colmd6 that has the extra padding that you need The colmd6 is the backbone to keep the column integrity but you can add additional padding w  Read More   Can a web designerdeveloper use free bootstrap templates to make a websiteweb app for a paying client  Chrysanthos Spiliotopoulos lives in Athens Greece       Written Jul 17 2014 Taken from Bootstrap web site   Read More   How learning bootstrap will help me  Lalit Pal former Web Designer 20172018       Written Dec 9 2018 It is useful But it depends on your need If it doesnt fulfill your requirements then it is not useful for you  Bootstrap is a nice framework designed to help developers i  Read More   Should I use my own CSS or Bootstrap  Frank M Taylor Certificate Computer Programming  FrontEnd Web       Development University Of Pho       Updated Aug 16 2017 It depends  Run far away from anyone who says yes or no without giving any consideration to what the requirements are Those people are dangerous  Consider Bootstrap when     T Read More   Which are some of the best bootstrap admin templates  Safwana Content Marketer at Mozilor Technologies       Written Feb 6 2019  ThemeForest is one of the popular places to find Bootstrap admin templates One of the trending admin templates now is JustDo The most attractive part of the template is t  Read More   Should I use bootstrap for performance critical web applications  Camille Spain Owner of Camille K Spain Web Design  Development       Written Jun 26 2017 Ill preface this by saying that Im not a Bootstrap fan Now you know my bias  Pros     Fast and easy to make a UI    You know it will be crossbrowser compatible not including an Read More   What tools do people use to build Bootstrap templates  J Alexander Curtis lives in Orem UT       Written Apr 5 2014 Simple answer They dont use any tools at all They simply modify the existing HTMLCSS or LESS of the source code Long Answer  Read More   Why does Bootstrap have 12 columns Is it possible to make the columns into 16 instead of 12 columns  Anuj Kapur Head of Design at Paisabazaar 2017present       Written Oct 17 2014 Thanks for the A2A Rajasekar More and more frameworks are changing to a 12 column layout so that content is more focussed than just design Text and its sizes have been  Read More   Is 12 the maximum amount of column I can add to a Bootstrap grid  Toby Hirsch Designed several websites with Bootstrap       Written May 28 2019 Yes but Bootstrap support nested columns What this means is that if you want a row with 18 columns you can first create a row with six columns Then within each of tho  Read More  Search More on Quora This email was sent by Quora 605 Castro Street Mountain View CA 94041 If you dont want to receive this type of email in the future please unsubscribehttpswwwquoracom,1,0,quora,curiosity-noreply,3290
229,invitations@linkedin.com,Sana Patel via LinkedIn,Lets start a conversation,See Sanas connections experience and more    Priyanjali Gupta                                  Sana Patel has accepted your invitation Lets start a conversation  Sana Patel                                                  Message        HR Executive at Deloitte India for Data Analytics        India       Message  Reach out to Sana  Sana thanks for connecting Hope youre doing well Start with this note                           Unsubscribe     Help               You are receiving Accepted Invitation emails     This email was intended for Priyanjali Gupta Student at Vellore Institute of Technology Core Committee member Robovitics  Learn why we                              included this                                      2021 LinkedIn Ireland Unlimited Company Wilton Plaza Wilton Place   Dublin 2 LinkedIn is a registered business name of LinkedIn Ireland     Unlimited Company LinkedIn and the LinkedIn logo are registered                          trademarks of LinkedIn,0,0,linkedin,invitations,980
230,jobalerts-noreply@linkedin.com,LinkedIn Job Alerts,4 new jobs for application developer,View jobs in New Delhi Delhi India                                                                                                                                                                  Your job alert for application developer 4 new jobs in New Delhi Delhi India match your preferences       Mobile Application Developer  NullClass  India            Actively recruiting        Mobile Application Developer  Start2StartUp  India            Actively recruiting        Mobile Application Developer  ezyFi Pvt Ltd  India            Actively recruiting        Mobile Application Developer  Travjo  India            Actively recruiting See all jobs     See jobs where youre a top applicant       Try Premium for free      This email was intended for Priyanjali Gupta Student at Vellore     Institute of Technology Core Committee member Robovitics  Learn     why we included this      You are receiving Job Alert emails     Manage job alerts     Unsubscribe     Help       2021 LinkedIn Ireland Unlimited Company Wilton Plaza Wilton     Place Dublin 2 LinkedIn is a registered business name of     LinkedIn Ireland Unlimited Company LinkedIn and the LinkedIn     logo are registered trademarks of LinkedIn,0,0,linkedin,jobalerts-noreply,1208
231,english-digest-noreply@quora.com,Quora Daily Digest,My age is 26 Almost attend 30 interviews but still not selected Now I am losing hop,Frootis Digest   Top Stories For You   My age is 26 Almost attend 30 interviews but still not selected Now I am losing hope What can I do Rahul Talreja Full Stack Developer 2019present  Updated September 28 2019 In 2016 I completed BE and went to Hyderabad for UPSC preparation Gave 3 attempts couldnt cleared even prelims  At that time I was losing hope but I thought its not the  Read More              14M                    32K                    60   What should be my CAT percentile to get into IIM Indore if my academics is 838277 Ankit Malik BSc from Hindu College University of Delhi 2021  Updated March 22  Sorry it might sound little rude but to be frank IIM Indore would be laughing at you right now  Why IIM Indore Shortlisting PI process   1 Gives 34 weightage to 10th score  2 G  Read More              2546K                      256                 28    Is a salary package of 18 LPA good enough to live in Bangalore If not then how much should be enough Bhavana Balakeshavalu lives in Bengaluru Karnataka India  Answered April 25 If youre a bachelor then with the package of 18LPA you can have a luxurious life or have a decent expenditure and save the rest for future  If youre married and have kid  Read More              11M                    12K                    43   As a fresher how can I introduce myself for a job interview Anshul Agarwal Senior User Experience Researcher at LinkedIn 2019present  Answered April 18  I interviewed with Microsoft Google LinkedIn Flipkart Franklin Templeton and cleared all of them Ive worked with all these companies  Photo source Instagram  I gave 70  Read More              1731K                        2K                8   I recently resigned from TCS They are offering me an onsite opportunity I think its a trap What should I do Nitin Ranjan worked at Tata Consultancy Services 20082021  Answered June 27 Very basic criteria to go to Onsite working at a clients location typically a foreign country from a service based companies like TCS Infosys CTS etc could be any one   Read More              18M                    19K                    82                       Read More in Your Feed                Never miss a story Designed for readers on the go         This email was sent by Quora 605 Castro Street Mountain View CA 94041      If you dont want to receive this type of email in the future please                                   unsubscribe                              httpswwwquoracom,1,0,quora,english-digest-noreply,2466
232,notifications-noreply@linkedin.com,LinkedIn,Congratulate Shivansh Joshi and 2 others,Heres whats happened since you were last on LinkedIn    Priyanjali Gupta                                                                   Congratulate Shivansh Joshi and 2 others for work anniversaries See whos celebrating  More updates    Congratulate Ananya Singh and 5 others for starting new             positions             See new positions                           Unsubscribe     Help              You are receiving LinkedIn notification emails     This email was intended for Priyanjali Gupta Student at Vellore Institute of Technology Core Committee member Robovitics  Learn why we                              included this                                      2021 LinkedIn Ireland Unlimited Company Wilton Plaza Wilton Place   Dublin 2 LinkedIn is a registered business name of LinkedIn Ireland     Unlimited Company LinkedIn and the LinkedIn logo are registered                          trademarks of LinkedIn,1,0,linkedin,notifications-noreply,926
233,technews@techgig.com,TechGig Latest News,Cognizant is hiring 1 lakh techies heres everything you must know  HCL is hiring techies for its new AWS Business Unit apply now,Daily Newsletter   Wednesday 10th November 2021   Cognizant is hiring 1 lakh techies heres everything you must know   HCL is hiring techies for its new AWS Business Unit apply now   Kickstart your career in Artificial Intelligence with this specialisation  course   This is the highest paying coding language and its not Python   Capgemini hiring BTech freshers for IT roles Apply now   Join this exclusive Data Science course by MIT IDSS for experienced tech  professionals   TCS Infosys HCL to bring 50 techies back to office by 2022   Explained What is Metaverse and how does it work   5 Biggest data science recruiters in India and the skills they seek   Advance your career in Data Science  Business Analytics with this course   Infosys is hiring engineers for multiple roles see how to apply   BITS Pilani is offering multiple courses for working techies enroll now   Indian gamers can now compete in Asian Games 2022 see how   Qualcomm announces Snapdragon Spaces for AR developers   Microsoft launches Surface Laptop SE with Windows 11 for students   Can your AI AR Full Stack and Cloud skills make healthcare accessible  Elsevier is looking for you   Top 3 highest paying Data Science job roles in IT Industry   Microsoft India is hiring tech freshers for multiple roles see details   Facebook recruiters share 8 things your next company must have   Everything about Digital Commerce as a career and why its the next big  thing                        See more news                        2021 TechGig  Terms of Use  Contact Us   TechGigcom Times Center FC  6 Sector 16 A Film City Noida  201301   Uttar Pradesh India    Spread the word about TechGig                              App Available on     Note For your privacy and protection please do not forward this mail to      anyone as it allows you to get automatically logged into your account        You have received this email because your are registered member on   TechGigcom If you do not want to receive this mailer unsubscribe To make   sure this email is not sent to your junkbulk folder select Addsave to   Address Book in your email browser and follow the appropriate instructions,0,0,techgig,technews,2153
234,updates@myntra.com,Myntra,Its Cold Out There But Cosy In Here,Sort your cold season essentials now   If you would prefer not receiving our emails please click here to  unsubscribe  If you would like to experience the best of online shopping for men women and kids in India you are at theright place Myntra is the ultimate destination for fashion and lifestyle being host to a wide array of merchandise including clothingfootwearaccessories jewellery personal care products and more It is time to redefine your style statement with our treasuretrove of trendy items Our online store brings you the latest in designer products straight out of fashion houses You can shop online at Myntra from the comfort of your home and get your favourites delivered right to your doorsteps,1,0,myntra,updates,711
235,hello@lifehack.org,Simon Lee,It wont be all sunshine and rainbows,You know  Most people are just too optimistic about everything these days They have this big project in mind A big goal they want to accomplish Maybe theyre thinking about quitting their jobs and going fullon with that business idea they have Or maybe they want to move to another country and start their lives from scratch And theres nothing wrong with that The problem is that theyve convinced themselves nothing bad will happen That it will all be sunshine and rainbows That the doors of heaven will open and things will just magically fall onto their lap All they have to do is stay positive And nothing bad will happen All because a motivational speaker on IG told them to take risks and everything will be OK And if somebody dares to ask them And what if things dont work out They immediately put them on the black list Theyre nonbelievers Pessimists who dont know what it takes to be successful After all theres no need for a plan When you have a 99 chance of succeeding Thats what they think Until crisis hits As it turns out Things were not going to be as easy as we thought Problems and challenges start coming from every possible direction Obstacles that you dont see how to manage through You start feeling like youre losing control Panic starts taking over you You get worried Anxious Everything you thought couldnt happen well Just did And you dont know how to manage that situation Youre faced with a wall And dont have the least idea how youll climb it You started your business thinking youll work from a beach in Hawaii sipping Pina Coladas But you didnt think youll have to work 20Hour days at first to lift it off the ground You started going to the gym to get shredded But you were not prepared to give in on that Papa Johns pizza you ate every weekend And in the middle of it all You end up giving up Because you didnt think it would be as hard Thats why if you really want to make your dreams come true and achieve your goals then theres something you must start to do And that is To start planning for the worst and hoping for the best Now with this Im not saying you should build your own private bomb shelter with canned beans stacked to the ceiling This is not a survival reality TV show Plus theres nothing wrong with being positive Actually you need to be if you want to achieve great things in life But You need to understand that behind every big dream and goal There are great challenges and setbacks to overcome And you cant ignore them Instead start treating them as a real possibility And start planning ahead in case something unexpected happens Go through every possible scenario in your head If youre planning on quitting your job ask yourself Do you have enough savings to support your family in case things go south Have you considered what to do if things dont go according to plan Do you have the skills you need to get another job if you need to Also do your research Ask other people how their experience was Those whove been through something similar and succeeded Theyll let you know where the bumps on the roads are Im not saying to be paranoid about what might happen If you start doing this today  Youll never be caught off guard again Youll have peace of mind Because youll be prepared for any challenge that comes your way Know exactly what to do And youll have the resilience and motivation to overcome any situation Keep that in mind Always forward Simon PS If you want to learn how to create a plan to overcome any challenge and make things happen in your life then Ill be more than happy to help you                            Sent to utaku0611gmailcom                                    Unsubscribe        Lifehack Unit 33554 PO Box 6945 London W1A 6US United Kingdom,1,0,lifehack,hello,3723
236,jobalerts-noreply@linkedin.com,LinkedIn Job Alerts,3 new jobs for developer intern,View jobs in United States                                                                                                                                                                  Your job alert for developer intern 3 new jobs in United States match your preferences       2022 Intern  Font Developer Intern  Adobe  Michigan United States            Actively recruiting        Developer Intern  Summer 2022  Great American Insurance Group  Cincinnati Ohio United States            Actively recruiting        Software Developer Summer Intern  Undergrad  Proofpoint  Broomfield Colorado United States            Actively recruiting See all jobs     See jobs where youre a top applicant       Try Premium for free      This email was intended for Priyanjali Gupta Student at Vellore     Institute of Technology Core Committee member Robovitics  Learn     why we included this      You are receiving Job Alert emails     Manage job alerts     Unsubscribe     Help       2021 LinkedIn Ireland Unlimited Company Wilton Plaza Wilton     Place Dublin 2 LinkedIn is a registered business name of     LinkedIn Ireland Unlimited Company LinkedIn and the LinkedIn     logo are registered trademarks of LinkedIn,0,0,linkedin,jobalerts-noreply,1206
